<?xml version="1.0" encoding="UTF-8"?>
<Catalog xmlns="http://www.OpenTravel.org/ns/OTA2/LibraryCatalog_v01_00"
		xmlns:xsi="http://www.w3.org/2001/XMLSchema-instance"
		xsi:schemaLocation="http://www.OpenTravel.org/ns/OTA2/LibraryCatalog_v01_00 ../../../main/resources/ota2-context/schemas/OTA2_LibraryCatalog_v1.0.0.xsd">
	
	<CatalogEntry>
		<Namespace>http://www.OpenTravel.org/ns/OTA2/SchemaCompiler/test-package_v1</Namespace>
		<Location>./test-package_v1/library_1_p1.xml</Location>
		<Location>./test-package_v1/library_2_p1.xml</Location>
	</CatalogEntry>
	
	<CatalogEntry>
		<Namespace>http://www.OpenTravel.org/ns/OTA2/SchemaCompiler/test-package_v2</Namespace>
		<Location>./test-package_v2/library_1_p2.xml</Location>
		<Location>./test-package_v2/library_2_p2.xml</Location>
	</CatalogEntry>
	
</Catalog>
